Facility,Name,Address,POINT_X,POINT_Y
Soccer,Lucas Secondary School Soccer Field #2,656 Tennent Ave,479777.9273,4764296.147
Soccer,Lucas Secondary School Soccer Field #1,656 Tennent Ave,479927.5372,4764361.201
Soccer,Sir John A. MacDonald Public School Soccer Field #1,1150 Landor St,482302.1875,4762182.895
Soccer,M.B. McEachren Public School Soccer Field #1,4402 Colonel Talbot Rd,475686.2168,4750615.422
Soccer,Mountsfield Public School Soccer Field #1,8 Mountsfield Dr,480040.41,4756388.508
Soccer,Montcalm Secondary School Soccer Field #1,1350 Highbury Ave N,482525.4488,4763578.331
Soccer,Northridge Public School Soccer Field #1,25 Mclean Dr,480920.0961,4764807.239
Soccer,Oakridge Secondary School Soccer Field #1,1040 Oxford St W,474272.7509,4758130.37
Soccer,Oakridge Secondary School Soccer Field #2,1040 Oxford St W,474217.9992,4758243.638
Soccer,Oakridge Secondary School Soccer Field #3,1040 Oxford St W,474260.8135,4758261.053
Soccer,Eagle Heights Public School School Soccer Field #3,284 Oxford St W,477673.3567,4759266.765
Soccer,Eagle Heights Public School School Soccer Field #2,284 Oxford St W,477620.6986,4759266.734
Soccer,Eagle Heights Public School School Soccer Field #1,284 Oxford St W,477605.8116,4759306.798
Soccer,Prince Charles Public School Soccer Field #2,1601 Wavell St,484756.513,4760021.351
Soccer,Prince Charles Public School Soccer Field #1,1601 Wavell St,484732.7077,4760076.651
Soccer,Princess Anne French Immersion Public School Soccer Field #1,191 Dawn Dr,485184.4117,4759848.107
Soccer,Regina Mundi Secondary School Soccer Field #1,5250 Wellington Rd S,483660.8278,4749314.161
Soccer,Regina Mundi Secondary School Soccer Field #2,5250 Wellington Rd S,483529.0453,4749315.869
Soccer,Sir George Ross Secondary School Soccer Field #1,365 Belfield St,480230.6441,4762749.322
Soccer,Sir Arthur Carty Separate School Soccer Field #1,1655 Ernest Ave,480400.1217,4753907.278
Soccer,Sir Isaac Brock Public School Soccer Field #1,80 St Lawrence Blvd,478701.8424,4754577.085
Soccer,St. Marguerite d'Youville Separate School Soccer Field #1,170 Hawthorne Rd,473786.5979,4761672.942
Soccer,St. Thomas Aquinas Secondary School Soccer Field #1,1360 Oxford St W,472704.8807,4757583.198
Soccer,Stoneybrook Public School Soccer Field #1,1460 Stoneybrook Cres,478591.2076,4763971.584
Soccer,Thames Secondary School Soccer Field #1,785 Trafalgar St,482229.3649,4758272.725
Soccer,University Heights Public School Soccer Field #1,27 Ford Cres,477393.0521,4760634.719
Soccer,Westdale Park Soccer Field #2 - Mini,1070 Quinton Rd,474436.367,4757838.768
Soccer,Westdale Park Soccer Field #1 - Mini,1070 Quinton Rd,474388.6058,4757843.264
Soccer,Westminster Secondary School Soccer Field #3,230 Base Line Rd W,477395.8233,4756496.99
Soccer,Westminster Secondary School Soccer Field #1,230 Base Line Rd W,477347.0263,4756417.969
Soccer,Saunders Secondary School Soccer Field #1,941 Viscount Rd,476272.7679,4754656.053
Soccer,G.A. Wheable Secondary School Soccer Field #2,70 Jacqueline St,482183.6221,4757485.22
Soccer,G.A. Wheable Secondary School Soccer Field #1,70 Jacqueline St,482128.3486,4757604.445
Soccer,Woodland Heights Public School Soccer Field #1,474 Springbank Dr,476559.9056,4756914.174
Soccer,Arthur Ford Public School Soccer Field #1,617 Viscount Rd,477975.1295,4755578.018
Soccer,Arthur Stringer Public School Soccer Field #1,43 Shaftesbury Ave,483077.6713,4755044.851
Soccer,Beal Secondary School Soccer Field #1,475 King St,480862.2581,4759252.017
Soccer,Bishop Townshend Public School Soccer Field #1,814 Quebec St,481817.3138,4761159.205
Soccer,Blessed Kateri Separate School Soccer Field #1,220 Sunnyside Dr,478544.6791,4763571.079
Soccer,Bonaventure Meadows Public School Soccer Field #1,141 Bonaventure Dr,487261.49,4761344.669
Soccer,Byron Northview Public School Soccer Field #1,1370 Commissioners Rd W,472427.4314,4756444.443
Soccer,Byron Southwood Public School Soccer Field #1,1379 Lola St,472874.5802,4755462.758
Soccer,C.C. Carrothers Public School Soccer Field #1,360 Chippendale Cres,482973.8314,4756722.182
Soccer,Catholic Central Secondary School Soccer Field #1,439 Queens Ave,480590.768,4759497.657
Soccer,Chippewa Public School Soccer Field #1,1035 Chippewa Dr,484025.6013,4763835.942
Soccer,Clara Brenton Public School Soccer Field #3,1025 St Croix Ave,474200.3086,4758663.193
Soccer,Clara Brenton Public School Soccer Field #1,1025 St Croix Ave,474211.8083,4758619.76
Soccer,Clarke Road Secondary School Soccer Field #1,300 Clarke Rd,486216.6453,4760871.254
Soccer,Ecole Marie-Curie Soccer Field #1,40 Hunt Club Dr,473349.6024,4758019.68
Soccer,Evelyn Harrison Public School Soccer Field #1,50 Tewksbury Cres,484188.1954,4763405.726
Soccer,F.D. Roosevelt Public School Soccer Field #1,560 Second St,484292.3392,4762011.167
Soccer,Fanshawe College Soccer Field #1,1460 Oxford St E,483418.4797,4762475.4
Soccer,Fanshawe College Soccer Field #3,1460 Oxford St E,483313.795,4762406.035
Soccer,Fanshawe College Soccer Field #4,1460 Oxford St E,483294.3324,4762409.226
Soccer,Fanshawe College Soccer Field #2,1460 Oxford St E,483330.6442,4762403.804
Soccer,Glen Cairn Public School Soccer Field #1,53 Frontenac Rd,483301.2043,4755984.341
Soccer,Hillcrest Public School Soccer Field #1,1231 Fuller St,481822.9147,4763176.439
Soccer,Holy Cross Separate School Soccer Field #1,18 Elm St,483068.4114,4758718.333
Soccer,Holy Rosary Separate School Soccer Field #1,268 Herkimer St,481196.7528,4757193.06
Soccer,John Dearness Public School Soccer Field #1,555 Sanatorium Rd,473170.9203,4757045.718
Soccer,John P. Robarts Public School Soccer Field #2,84 Bow St,487002.6965,4759597.341
Soccer,John P. Robarts Public School Soccer Field #1,84 Bow St,487055.6334,4759710.207
Soccer,John Paul II Secondary School Soccer Field #1,1300 Oxford St E,483175.7563,4761936.307
Soccer,Lord Elgin Public School Soccer Field #1,1100 Victoria Dr,481655.5795,4762456.081
Soccer,Lord Nelson Public School Soccer Field #1,1990 Royal Cres,486427.0633,4760828.23
Soccer,Lucas Secondary School Soccer Field #3,656 Tennent Ave,479725.9275,4764268.26
Soccer,Masonville Public School Soccer Field #1,25 Hillview Blvd,476755.3942,4763631.627
Soccer,Montcalm Secondary School Soccer Field #2,1350 Highbury Ave N,482580.7797,4763482.115
Soccer,Nicholas Wilson Public School Soccer Field #2,927 Osgoode Dr,482325.1827,4754042.274
Soccer,Nicholas Wilson Public School Soccer Field #3,927 Osgoode Dr,482318.3742,4754067.18
Soccer,Nicholas Wilson Public School Soccer Field #1,927 Osgoode Dr,482324.7569,4753990.512
Soccer,Oakridge Secondary School Soccer Field #4,1040 Oxford St W,474398.0128,4758118.553
Soccer,Princess Elizabeth Public School Soccer Field #1,247 Thompson Rd,481965.28,4757147.819
Soccer,Rick Hansen Public School Soccer Field #1,70 Ponderosa Cres,481098.0364,4753837.669
Soccer,Riverside Public School Soccer Field #1,550 Pinetree Dr,475154.054,4758069.194
Soccer,Robarts School for the Deaf Soccer Field #1,1090 Highbury Ave N,482940.7863,4762093.644
Soccer,Ryerson Public School Soccer Field #1,940 Waterloo St,479572.5529,4761313.635
Soccer,Sir Georges Etienne Cartier Public School Soccer Field #2,695 Chiddington Ave,480926.1073,4755739.871
Soccer,Sir Georges Etienne Cartier Public School Soccer Field #1,695 Chiddington Ave,480865.1359,4755775.344
Soccer,South Secondary School Soccer Field #1,371 Tecumseh Ave e,480234.778,4757319.264
Soccer,St. Anne Separate School Soccer Field #1,1366 Huron St,482700.8586,4763286.871
Soccer,St. Anthony Separate School Soccer Field #1,1380 Ernest Ave,480950.4175,4753209.096
Soccer,St. Bernadette Separate School Soccer Field #1,155 Tweedsmuir Ave,485022.7404,4758744.017
Soccer,St. Francis Separate School Soccer Field #1,690 Osgoode Dr,483038.5143,4754641.562
Soccer,St. Jude Separate School Soccer Field #1,690 Viscount Rd,478112.6714,4755097.084
Soccer,St. Mark Separate School Soccer Field #1,1440 Glenora Dr,480808.7056,4764777.383
Soccer,St. Mark Separate School Soccer Field #2,1440 Glenora Dr,480842.385,4764705.611
Soccer,St. Michael Separate School Soccer Field #1,926 Maitland St,480150.0433,4761247.016
Soccer,St. Paul Separate School Soccer Field #2,1090 Guildwood Blvd,473959.2276,4758359.06
Soccer,St. Paul Separate School Soccer Field #1,1090 Guildwood Blvd,473938.4908,4758413.081
Soccer,St. Pius X Separate School Soccer Field #1,255 Vancouver St,484910.5885,4760022.465
Soccer,St. Robert Separate School Soccer Field #1,1958 Duluth Cres,486381.7739,4760242.374
Soccer,St. Sebastian Separate School Soccer Field #1,225 Cairn St,483254.1938,4756860.218
Soccer,St. Thomas More Separate School Soccer Field #1,18 Wychwood Pk,476463.4182,4760762.37
Soccer,Tweedsmuir Public School Soccer Field #1,349 Tweedsmuir Ave,485381.8042,4758759.264
Soccer,University of Western Ontario Soccer Field #1,Huron Dr (pvt),477684.5367,4760832.054
Soccer,W.D. Sutton Public School Soccer Field #1,1250 Dundas St,483150.4798,4760608.942
Soccer,Westminster Central Public School Soccer Field #1,2835 Westminster Dr,483772.1512,4749807.985
Soccer,Westminster Secondary School Soccer Field #2,230 Base Line Rd W,477310.7262,4756505.376
Soccer,Westmount Public School Soccer Field #1,1011 Viscount Rd,476016.3494,4754642.814
Soccer,Springbank Park Soccer Field #4 - Mini,1085 Commissioners Rd W,473391.813,4756272.681
Soccer,Springbank Park Soccer Field #1 - Mini,1085 Commissioners Rd W,473025.9806,4756369.756
Soccer,Springbank Park Soccer Field #2 - Mini,1085 Commissioners Rd W,473017.8885,4756421.801
Soccer,Springbank Park Soccer Field #3 - Mini,1085 Commissioners Rd W,472937.0326,4756457.8
Soccer,West Lions Park Soccer Field #1,20 Grandville St,478213.7369,4759323.515
Soccer,Silverwoods Park Soccer Field #1,50 Sycamore St,483267.4909,4759066.761
Soccer,Carling Park Soccer Field #1 - Mini,675 Grosvenor St,480928.7441,4761311.481
Soccer,Carling Park Soccer Field #3 - Mini,675 Grosvenor St,480798.3323,4761310.887
Soccer,Carling Park Soccer Field #2 - Mini,675 Grosvenor St,480868.2215,4761286.574
Soccer,East Lions Park Soccer Field #1,1731 Churchill Ave,485092.1983,4760418.856
Soccer,Jorgenson Park Soccer Field #1 - Mini,1308 Norman Ave,472704.9554,4755913.018
Soccer,University Heights Park Soccer Field #1 - Mini,290 Trott Dr,477083.849,4760153.41
Soccer,Oak Park Soccer Field #1,1207 Royal York Rd,473368.2454,4758279.511
Soccer,St. Stephen's Park Soccer Field #1 - Mini,1030 Mitchel St,481846.8964,4753692.944
Soccer,Kensal Park Soccer Field #1 - Mini,150 Chelsea Ave,477053.9107,4757923.889
Soccer,Kensal Park Soccer Field #2 - Mini,150 Chelsea Ave,476915.9564,4757887.08
Soccer,Chelsea Green Park Soccer Field #1,1 Adelaide St S,481427.3055,4757966.675
Soccer,Greenway Park Soccer Field #5,50 Greenside Ave,477779.8435,4758200.226
Soccer,Greenway Park Soccer Field #1 - Mini,50 Greenside Ave,477858.0663,4758295.867
Soccer,Greenway Park Soccer Field #4 - Mini,50 Greenside Ave,476687.3189,4758076.93
Soccer,Greenway Park Soccer Field #3,50 Greenside Ave,476575.8116,4758045.358
Soccer,Greenway Park Soccer Field #2,50 Greenside Ave,477709.8556,4758282.646
Soccer,St. Lawrence Park Soccer Field #1 - Mini,5 St. Lawrence Blvd,478400.9624,4754798.022
Soccer,Westminster Optimist Park Soccer Field #1 - Mini,650 Osgoode Dr,483110.6158,4754474.14
Soccer,Westmount Lions Park Soccer Field #1,784 Viscount Rd,477170.1343,4755247.218
Soccer,Hastings Park Soccer Field #1 - Micro,1428 Hastings Dr,478506.1781,4763721.673
Soccer,Hastings Park Soccer Field #2 - Micro,1428 Hastings Dr,478466.917,4763701.014
Soccer,Mitches Park Soccer Field #1 - Mid,640 Upper Queens St,480631.0982,4755201.987
Soccer,Grand View Park Soccer Field #1 - Mini, 385 Grandview Ave,471858.8111,4756141.672
Soccer,Ted Early Sports Complex Soccer Field #3,1375 Clarke Rd,484256.0999,4764421.017
Soccer,Ted Early Sports Complex Soccer Field #2,1375 Clarke Rd,484338.5121,4764448.589
Soccer,Ted Early Sports Complex Soccer Field #1,1375 Clarke Rd,484420.5982,4764486.419
Soccer,Cleardale Park Soccer Field #2,817 Nixon Ave,480510.5788,4754648
Soccer,Constitution Park Soccer Field #1,725 Grenfell Dr,479886.7915,4765311.98
Soccer,Stoneybrook Recreation Field Soccer Field #1,815 Windermere Rd,479906.3239,4763317.394
Soccer,White Oaks Park Soccer Field #1,1119 Jalna Blvd,481113.5552,4753224.727
Soccer,White Oaks Park Soccer Field #3 - Mini,1394 Ernest Ave,480758.6784,4753299.591
Soccer,White Oaks Park Soccer Field #2 - Mini,1394 Ernest Ave,480804.6799,4753301.808
Soccer,Gainsborough Meadows Soccer Field #1,102 Brandy Lane Rd,474392.5725,4760671.753
Soccer,Ed Blake Park Soccer Field #1,449 Barker St,480983.5589,4762726.812
Soccer,White Oaks Optimist Park Soccer Field #1,560 Bradley Ave,481037.561,4753652.016
Soccer,Chesham Heights Park Soccer Field #1 - Mini,328 Castlegrove Blvd,476476.981,4760364.21
Soccer,Belmont Park Soccer Field #1,741 Lenore St,478645.7122,4754775.322
Soccer,Earl Nichols Park And Arena Soccer Field #1 - Mini,799 Homeview Rd,479431.1178,4754731.278
Soccer,North London Athletic Fields Soccer Field #2,1225 Adelaide St N,479578.0413,4762900.79
Soccer,North London Athletic Fields Soccer Field #4,1225 Adelaide St N,479342.5427,4762748.768
Soccer,North London Athletic Fields Soccer Field #3,1225 Adelaide St N,479444.9695,4762874.001
Soccer,North London Athletic Fields Soccer Field Stadium,1225 Adelaide St N,479452.3245,4762734.416
Soccer,North London Athletic Fields Soccer Field #1,1225 Adelaide St N,479616.5893,4762805.673
Soccer,Naiomi Almeida Park Soccer Field #1 - Mini,828 Deveron Cres,484200.6512,4757219.058
Soccer,Jesse Davidson Park Soccer Field #1,731 Viscount Rd,477414.1871,4754730.272
Soccer,Jesse Davidson Park Soccer Field #2,731 Viscount Rd,477274.5805,4754731.93
Soccer,Southwest Optimist Park Soccer Field #1,682 Southdale Rd W,475601.6071,4754081.571
Soccer,Whisperwood Park Soccer Field  #1 - Mini,211 Whisperwood Ave,473555.0342,4754998.885
Soccer,Cresthaven Park Soccer Field #1,104 Parks Edge Cres,474851.4908,4755005.297
Soccer,Cheswick Park Soccer Field #1 - Mini,88 Lacey Cres,480423.8225,4752933.42
Soccer,Windermere Fields Soccer Field #2,745 Windermere Rd,479697.4796,4763239.237
Soccer,Windermere Fields Soccer Field #3,745 Windermere Rd,479723.138,4763168.036
Soccer,Windermere Fields Soccer Field #1,745 Windermere Rd,479661.9772,4763322.109
Soccer,Jaycee Park Soccer Field #1 - Mini,1830 Aldersbrook Rd,473982.6539,4762338.846
Soccer,Ralph Hamlyn Park Soccer Field #1 - Mini,83 Dennis Ave,476620.596,4750623.496
Soccer,Nicholas Wilson Park Soccer Field #1 - Mini,16 Fitzroy Pl,482454.4953,4754101.464
Soccer,Heritage Park Soccer Field #1 - Mini,150 Bexhill Dr,483668.4662,4754432.241
Soccer,Springbank Flats Soccer Field #1,67 Springbank Dr,478190.4029,4758195.011
Soccer,St. Julien Park Soccer Field #1,15 Tommy Hunter Way,483917.0123,4758102.249
Soccer,Reservoir Park Soccer Field #1 - Mini,869 Commissioners Rd W,474705.3141,4755753.736
Soccer,Reservoir Park Soccer Field #2 - Mini,869 Commissioners Rd W,474745.5792,4755740.789
Soccer,Lambeth Centennial Park Soccer Field #5 - Mini,7112 Beattie St,474901.4718,4751009.696
Soccer,Lambeth Centennial Park Soccer Field #1,7112 Beattie St,474998.0328,4751022.721
Soccer,Virginia Park Soccer Field #1 - Mini,225 Chambers Ave,478196.9513,4764874.695
Soccer,City Wide Sports Park Soccer Field #1,1510 Commissioners Rd E,485370.2187,4756913.579
Soccer,City Wide Sports Park Soccer Field #2,1510 Commissioners Rd E,485462.1056,4756923.285
Soccer,North London Athletic Fields Soccer Field #5A - Mid,1225 Adelaide St N,479468.4367,4762615.476
Soccer,North London Athletic Fields Soccer Field #5B - Mid,1225 Adelaide St N,479472.152,4762556.478
Soccer,St. Julien Park Soccer Field #2 - Mini,15 Tommy Hunter Way,483909.8439,4758124.417
Soccer,St. Julien Park Soccer Field #3 - Mini,15 Tommy Hunter Way,483922.529,4758080.548
Soccer,St. Julien Park Soccer Field #4 - Mini,15 Tommy Hunter Way,483767.1364,4758046.721
Soccer,St. Julien Park Soccer Field #5 - Mini,15 Tommy Hunter Way,483777.7074,4758008.665
Soccer,University of Western Ontario Soccer Field #2,Huron Dr (pvt),477819.0775,4761312.715
Soccer,University of Western Ontario Soccer Field #3,Huron Dr (pvt),477864.6449,4761456.086
Soccer,Cantebury Park Soccer Field #1,99 Prince Of Wales Gate,472905.7202,4760090.354
Soccer,Plane Tree Park Soccer Field #1,214 Plane Tree Dr,476007.2529,4764090.074
Soccer,Plane Tree Park Soccer Field #2,214 Plane Tree Dr,476050.3945,4764122.053
Soccer,Northwest Optimist Park Soccer Field #1,48 Hawthorne Rd,474342.7234,4761985.352
Soccer,W. Sherwood Fox Public School Soccer Field #1,660 Steeplechase Dr,476858.445,4755345.131
Soccer,Stephens Farm Park Soccer Field #1 - Mini,887 South Wenige Dr,479352.5105,4766025.686
Soccer,Paul Haggis Park Soccer Field #1 - Mini,2875 Bateman Trail,479092.8701,4753433.014
Soccer,Riverbend Park Soccer Field #1,1585 Riverbend Rd,470382.4384,4757701.215
Soccer,Riverbend Park Soccer Field #2,1585 Riverbend Rd,470440.1176,4757634.54
Soccer,Settlement Trail,3470 Settlement Trail,475069.5369,4753493.831
Soccer,Lambeth Optimist Park Soccer Field #1,4200 Campbell St N,476114.6892,4751517.65
Soccer,Cleardale Park Soccer Field #1,817 Nixon Ave,480422.5012,4754642.427
Soccer,Hastings Park Soccer Field #3 - Micro,1428 Hastings Dr,478438.3419,4763689.584
Soccer,Hastings Park Soccer Field #3 - Micro,1428 Hastings Dr,478489.777,4763711.174
Soccer,Plane Tree Park Soccer Field #3,214 Plane Tree Dr,476131.754,4764169.281
Soccer,Virginia Park Soccer Field #2 - Mini,225 Chambers Ave,478247.7514,4764976.693
Soccer,North London Athletic Fields Soccer Field #6 - Mini,1225 Adelaide St N,479475.327,4762587.038
Soccer,The Green Soccer Field #1,165 Elmwood Ave E,479532.6715,4757503.941
Soccer,Hazelden Park Soccer Field #1,430 Hyde Park Rd,474198.7279,4757042.99
Soccer,Southwest Optimist Park Soccer Field #2,682 Southdale Rd W,475588.1156,4754159.933
Soccer,Lambeth Centennial Park Soccer Field #3 - Mini,7112 Beattie St,475039.4472,4750961.367
Soccer,Meadowgate Fields Soccer Field #1,3155 Meadowgate Blvd,485904.0156,4755728.621
Soccer,Meadowgate Fields Soccer Field #2,3155 Meadowgate Blvd,485919.3028,4755657.343
Soccer,Murray Park Soccer Field #1,75 Cliftonvale Ave,478176.3343,4757248.979
Soccer,Murray Park Soccer Field #2,75 Cliftonvale Ave,478133.6738,4757241.39
Soccer,Beaverbrook Woods Soccer Field #1,780 Mapleridge St,475195.2374,4759516.299
Soccer,Boyle Community Centre / Park Field #1,530 Charlotte St,482238.4565,4760486.266
Soccer,Boyle Community Centre / Park Field #2,530 Charlotte St,482243.931,4760470.911
Soccer,Boyle Community Centre / Park Field #3,530 Charlotte St,482251.7968,4760456.198
Soccer,Byron Hills Park Field #1,955 Byronmanor Rd,473909.9878,4753911.644
Soccer,Glen Cairn Park - East Field #1,170 Helena Ave,482618.8926,4756815.601
Soccer,Huron Heights Park Field #1,185 Mcnay St,481868.5601,4762169.966
Soccer,Whetherfield Park Field #1,1115 Whetherfield St,474735.9143,4759195.899
Soccer,Thames Park Field #1,15 Ridout St S,479329.8521,4758102.459
Soccer,Westminster Ponds-Dearness Open Space Field #1,710 Southdale Rd E,481801.6129,4754674.463
Soccer,North London Athletic Fields #7,1225 Adelaide St N,479672.8835,4762947.225
Soccer,Greenway Park Soccer Field #6,50 Greenside Ave,477686.2829,4758276.1
Soccer,Greenway Park Soccer Field #7,50 Greenside Ave,477739.5699,4758290.215
Soccer,Hazelden Park Soccer Field #2,430 Hyde Park Rd,474189.3883,4757068.597
Soccer,Hazelden Park Soccer Field #3,430 Hyde Park Rd,474206.158,4757021.555
Soccer,Jesse Davidson Park Soccer Field #3,731 Viscount Rd,477391.4637,4754727.344
Soccer,Jesse Davidson Park Soccer Field #4,731 Viscount Rd,477435.1335,4754737.325
Soccer,Meadowgate Fields Soccer Field #3,3155 Meadowgate Blvd,485881.4147,4755722.622
Soccer,Meadowgate Fields Soccer Field #4,3155 Meadowgate Blvd,485931.9007,4755737.393
Soccer,Meadowgate Fields Soccer Field #5,3155 Meadowgate Blvd,485952.7905,4755666.384
Soccer,North London Athletic Fields Soccer Field #8,1225 Adelaide St N,479442.5577,4762898.367
Soccer,North London Athletic Fields Soccer Field #9,1225 Adelaide St N,479446.5568,4762847.733
Soccer,North London Athletic Fields Soccer Field #10,1225 Adelaide St N,479340.9004,4762774.434
Soccer,North London Athletic Fields Soccer Field #11,1225 Adelaide St N,479343.3729,4762726.06
Soccer,Southwest Optimist Park Soccer Field #3,682 Southdale Rd W,475565.8242,4754157.058
Soccer,Southwest Optimist Park Soccer Field #4,682 Southdale Rd W,475614.2307,4754163.696
Soccer,The Green Soccer Field #2,165 Elmwood Ave E,479578.1026,4757521.921
Soccer,Lambeth Optimist Park Soccer Field #2,4200 Campbell St N,476102.1104,4751529.373
Soccer,Lambeth Optimist Park Soccer Field #3,4200 Campbell St N,476133.2773,4751501.298
Soccer,Murray Park Soccer Field #3,75 Cliftonvale Ave,478154.6698,4757246.516
Soccer,Vista Woods Park Soccer Field #1,1075 Melsetter Way,473997.6967,4763166.972
Wading Pool,Springbank Park Wading Pool,1085 Commissioners Rd W,473418.5924,4756355.469
Spray Pad,Gibbons Park - Spray Pad,2B Grosvenor St,478658.8296,4760707.474
Spray Pad,West Lions Park Spray Pad,20 Granville St,478439.7475,4759380.431
Wading Pool,Silverwoods Park Wading Pool,50 Sycamore St,483167.1393,4758994.333
Wading Pool,McMahen Park Wading Pool,640 Adelaide St N,480901.7504,4760484.586
Spray Pad,Kiwanis Park Spray Pad,612 Hale St,484044.9008,4760297.084
Spray Pad,Rowntree Park Spray Pad,750 Whetter Ave,481305.5353,4757072.315
Wading Pool,East Lions Park Wading Pool,1731 Churchill Ave,485132.1546,4760505.963
Wading Pool,Smith Park Wading Pool,194 Brampton Rd,480907.928,4761922.204
Wading Pool,Meredith Park Wading Pool,450 Nelson St,481035.9611,4758262.324
Wading Pool,Murray Park Wading Pool,75 Cliftonvale Ave,478240.6958,4757282.28
Wading Pool,Jorgenson Park Wading Pool,1308 Norman Ave,472683.9196,4756043.148
Wading Pool,University Heights Park Wading Pool,290 Trott Dr,477148.2731,4760144.843
Wading Pool,Northeast Recreation Centre Wading Pool,1050 Victoria Dr,481623.7499,4762309.759
Spray Pad,Jesse Davidson Park Spray Pad,731 Viscount Rd,477389.7368,4754771.287
Wading Pool,Northridge Pool  Wading Pool,15 Mclean Dr,480792.285,4764917.841
Spray Pad,Ivey Park Spray Pad,331 Thames St,479145.9912,4758803.571
Spray Pad,Lambeth Centennial Park Spray Pad,7112 Beattie St,475141.5142,4750768.357
Spray Pad,Bonaventure Meadows Park Spray Pad,141 Bonaventure Dr,487352.5308,4761367.467
Spray Pad,Southeast Optimist Park- Spray Pad,237 Deveron Cres,484104.8656,4755956.59
Spray Pad,Ed Blake Park - Spray Pad,449 Barker St,480932.5061,4762914.637
Spray Pad,Medway Park - Spray Pad,1051 Wonderland Rd N,475304.0375,4761126.308
Spray Pad,Oakridge Optimist Park - Spray Pad,825 Valetta St,474980.7295,4758128.607
Spray Pad,Meadowgate Park - Spray Pad,3155 Meadowgate Blvd,485963.5641,4755795.113
Spray Pad,Springbank Park - Spray Pad,1085 Commissioners Rd W,474336.5246,4756151.951
Spray Pad,South London Community Centre Spray Pad,1119 Jalna Blvd,481335.1513,4753213.185
Spray Pad,Constitution Park Spray Pad,725 Grenfell Dr,479813.1921,4765241.525
Tennis,Lucas Secondary School Tennis Court #2,656 Tennent Ave,479767.7416,4764501.46
Tennis,Banting Secondary School Tennis Court #2,125 Sherwood Forest Sq,475139.3182,4760994.32
Tennis,Central Secondary School Tennis Court #2,509 Waterloo St,479987.5916,4759630.367
Tennis,Clarke Road Secondary School Tennis Court #2,300 Clarke Rd,486053.7067,4760844.688
Tennis,Montcalm Secondary School Tennis Court #2,1350 Highbury Ave N,482458.4409,4763626.972
Tennis,Oakridge Secondary School Tennis Court #2,1040 Oxford St W,474354.8139,4758152.355
Tennis,Saunders Secondary School Tennis Court #3,941 Viscount Rd,476268.8867,4754730.512
Tennis,Laurier Secondary School Tennis Court #2,450 Millbank Dr,483149.0476,4754857.528
Tennis,Westminster Secondary School Tennis Court #2,230 Base Line Rd W,477269.2661,4756305.834
Tennis,Saunders Secondary School Tennis Court #1,941 Viscount Rd,476235.8853,4754725.499
Tennis,Saunders Secondary School Tennis Court #2,941 Viscount Rd,476252.6577,4754728.059
Tennis,Saunders Secondary School Tennis Court #4,941 Viscount Rd,476286.1072,4754733.961
Tennis,Westminster Secondary School Tennis Court #1,230 Base Line Rd W,477254.7045,4756304.147
Tennis,Westminster Secondary School Tennis Court #3,230 Base Line Rd W,477283.5269,4756307.741
Tennis,Westminster Secondary School Tennis Court #4,230 Base Line Rd W,477298.3299,4756309.364
Tennis,Oakridge Secondary School Tennis Court #3,1040 Oxford St W,474342.2863,4758148.165
Tennis,Oakridge Secondary School Tennis Court #1,1040 Oxford St W,474367.473,4758157.159
Tennis,Banting Secondary School Tennis Court #3,125 Sherwood Forest Sq,475133.6334,4761007.375
Tennis,Banting Secondary School Tennis Court #1,125 Sherwood Forest Sq,475143.6735,4760980.878
Tennis,Lucas Secondary School Tennis Court #1,656 Tennent Ave,479753.3086,4764495.668
Tennis,Lucas Secondary School Tennis Court #3,656 Tennent Ave,479781.0682,4764507.23
Tennis,Lucas Secondary School Tennis Court #4,656 Tennent Ave,479793.2911,4764512.603
Tennis,Montcalm Secondary School Tennis Court #1,1350 Highbury Ave N,482446.0089,4763622.139
Tennis,Montcalm Secondary School Tennis Court #3,1350 Highbury Ave N,482470.8445,4763631.992
Tennis,Central Secondary School Tennis Court #1,509 Waterloo St,479975.1143,4759625.661
Tennis,Central Secondary School Tennis Court #3,509 Waterloo St,479999.895,4759634.979
Tennis,Clarke Road Secondary School Tennis Court #1,300 Clarke Rd,486039.6474,4760839.68
Tennis,Clarke Road Secondary School Tennis Court #3,300 Clarke Rd,486067.7572,4760850.234
Tennis,Laurier Secondary School Tennis Court #1,450 Millbank Dr,483135.8822,4754858.64
